Name,City,Area,Type
Thakur College of Engineering and Technology,Mumbai,Kandivali,Engineering
K.J. Somaiya College of Engineering,Mumbai,Vidyavihar,Engineering
Sardar Patel College of Engineering,Mumbai,Andheri,Engineering
Fr. Conceicao Rodrigues College of Engineering,Mumbai,Bandra,Engineering
Vivekanand Education Society Institute of Technology,Mumbai,Chembur,Engineering
Rajiv Gandhi Institute of Technology,Mumbai,Andheri,Engineering
Atharva College of Engineering,Mumbai,Malad,Engineering
Shah and Anchor Kutchhi Engineering College,Mumbai,Chembur,Engineering
Vidyalankar Institute of Technology,Mumbai,Wadala,Engineering
D.J. Sanghvi College of Engineering,Mumbai,Vile Parle,Engineering
Mukesh Patel School of Technology Management and Engineering,Mumbai,Vile Parle,Engineering
Thadomal Shahani Engineering College,Mumbai,Bandra,Engineering
Pillai College of Engineering,Mumbai,Panvel,Engineering
Rizvi College of Engineering,Mumbai,Bandra,Engineering
Indian Institute of Technology Bombay,Mumbai,Powai,Engineering
Veermata Jijabai Technological Institute,Mumbai,Matunga,Engineering
